{
  "collector": {
    "interval_seconds": 30
  },
  "community_server": {
    "detail": null,
    "last_success_at": "2026-10-08T22:53:08Z",
    "observed_at": "2026-10-08T22:53:08Z",
    "players": null,
    "shares_evidence_with": "rcon",
    "source": "rcon",
    "source_label": "Via RCON",
    "state": "responding"
  },
  "demo": true,
  "discord": {
    "detail": null,
    "last_connected_at": "2026-10-08T22:03:20Z",
    "observed_at": "2026-10-08T22:53:10Z",
    "source": "discord_gateway_events",
    "state": "reconnecting"
  },
  "expiry": {
    "heartbeat_seconds": 180,
    "observation_seconds": 180,
    "public_json_seconds": 120
  },
  "generated_at": "2026-10-08T22:53:20Z",
  "monitoring": {
    "snapshot": "ok",
    "state": "ok"
  },
  "rcon": {
    "category": null,
    "consecutive_failures": 0,
    "detail": null,
    "last_attempt_at": "2026-10-08T22:53:08Z",
    "last_success_at": "2026-10-08T22:53:08Z",
    "source": "rcon_status_poll",
    "state": "healthy"
  },
  "schema_version": 1,
  "votebot": {
    "application_health": "confirmed",
    "application_reason": null,
    "checked_at": "2026-10-08T22:53:20Z",
    "detail": null,
    "source": "systemd",
    "state": "running"
  }
}
